Title,Company,Location,Experience,Description,Apply Link,Tags,Posted
Senior Python Developer (Pandas and Numpy - Must),Atyeti,"Hybrid - Pune, Mumbai (All Areas)",4-9 Yrs,Working experience on APIs is a must . 4+ years of Total experience An extensive exper...,https://www.naukri.com/job-listings-senior-python-developer-pandas-and-numpy-must-atyeti-pune-mumbai-all-areas-4-to-9-years-010725014611,"OOPS, Pandas, Numpy, Python, Django, Flask, Development, Senior",4 days ago
AI/ML Developer,Oak Tree Software,Indore,3-8 Yrs,Oak Tree Software is looking for AI/ML Developer to join our dynamic team and embark on...,https://www.naukri.com/job-listings-ai-ml-developer-oak-tree-software-indore-3-to-8-years-020725502060,"innovation, python, data analytics, natural language processing, neural networks, aiml, machine learning, artificial intelligence",3 days ago
Machine Learning Engineer - pune- wfh,A CLIENT OF INSIGHT,Pune,3-8 Yrs,"3yrs exp in machine learning, AI eng, or related role Strong prog skills in Python, &ex...",https://www.naukri.com/job-listings-machine-learning-engineer-pune-wfh-insight-consultancy-services-pune-3-to-8-years-020725025815,"Tensorflow, Pytorch, Aiml, Machine Learning, Python, Pandas, Data Modeling, Numpy",3 days ago
Python Developer,Dynamic Vishva,Remote,1-3 Yrs,DYNAMIC VISHVA is looking for Python Developer to join our dynamic team and embark on a...,https://www.naukri.com/job-listings-python-developer-dynamic-vishva-remote-1-to-3-years-200625500846,"python, css, c, software testing, natural language processing, python development, machine learning, artificial intelligence",2 weeks ago
Python Developer - AI & LLM Developer - Immediate Joiners Preferred,Celestiq Datatech,Pune,2-5 Yrs,Preferred candidate profile Were looking for a skilled Python Developer with strong han...,https://www.naukri.com/job-listings-python-developer-ai-llm-developer-immediate-joiners-preferred-celestiq-datatech-private-limited-pune-2-to-5-years-240625012702,"Natural Language Processing, Large Language Model, Django Framework, Python, Claude, LLM, Machine Learning, Numpy",1 week ago
Python Developer,Ambit Software,Pune,3-8 Yrs,Availability to work full timeRequirements: 3+ years of software development experience...,https://www.naukri.com/job-listings-python-developer-ambit-software-pune-3-to-8-years-260625033852,"Scrapy, API Extraction, Django, Spidermon, Python, API, Python Development, Extraction",3 days ago
AI Developer,SNS System,Remote,0-3 Yrs,"Expertise in AI Frameworks: You have hands-on experience with tools like TensorFlow, Py...",https://www.naukri.com/job-listings-ai-developer-sns-system-remote-0-to-3-years-020725503303,"Computer vision, deep learning, data science, GCP, Focus, Machine learning, Deployment, Natural language processing",3 days ago
Python Developer (Pandas),Leading Client,Mumbai,4-8 Yrs,Develop data processing applications using Python and Pandas. Optimize performance for ...,https://www.naukri.com/job-listings-python-developer-pandas-teamware-solutions-a-division-of-quantum-leap-co-nsulting-private-ltd-mumbai-4-to-8-years-260625939197,"python, data analysis, data processing, python development, pandas, css, natural language processing, numpy",1 week ago
Junior Data Scientist,Talent Corner Hr Services,Pune,2-7 Yrs,Work with the founder and core team to build and optimize quant trading strategies. Use...,https://www.naukri.com/job-listings-junior-data-scientist-talent-corner-hr-services-pune-2-to-7-years-260625025152,"Data Cleanup, Pandas, Statistical Analyses, Machine Learning, Python, Data Pipeline, Algorithmic Trading, Stock Market",1 week ago
"Python Developer (Pandas ,Numpy)",Wintech Services,Hyderabad,5-8 Yrs,"Data Engineering concepts (PySpark, NumPy, Pandas, AWS Glue and Airflow) SQL (basic and...",https://www.naukri.com/job-listings-python-developer-pandas-numpy-wintech-services-hyderabad-5-to-8-years-030725021767,"Airflow, Pandas, AWS, Numpy, Python, Python Development, Development",2 days ago
Python Developer,Realizer Technologies,Pune,2-3 Yrs,"The candidate should be able to work with functional business analysts, business proces...",https://www.naukri.com/job-listings-python-developer-realizer-techonlogies-pune-2-to-3-years-280525503695,"python, css, natural language processing, python development, numpy, machine learning, artificial intelligence, javascript",3+ weeks ago
Python Developer,Apex 2000 INC,"Pune, Kolkata, Mumbai, New Delhi, Hyderabad, Chennai, Bengaluru",4-7 Yrs,Apex 2000 INC is looking for Python Developer to join our dynamic team and embark on a ...,https://www.naukri.com/job-listings-python-developer-apex-2000-inc-kolkata-mumbai-new-delhi-hyderabad-pune-chennai-bengaluru-4-to-7-years-170625504835,"css, apex, sql, docker, git, data science, postgresql, linux",2 weeks ago
"AI,ML Python Developer",Avisoft,"Mumbai, Delhi / NCR, Bengaluru",4-7 Yrs,"Bachelors degree in Computer Science, Information Technology, or a related field. We ar...",https://www.naukri.com/job-listings-ai-ml-python-developer-avisoft-mumbai-delhi-ncr-bengaluru-4-to-7-years-230625923498,"Python, Unit Testing, Sage maker, Design Patterns, pytest, PySpark, Python Developer, AI",1 week ago
Python Developer,Centralogic,Pune,2-5 Yrs,"Skills Preferred: Data Analytics, PyTorch, LLMS, RAG, PANDAS . Qualification: Any - (BE...",https://www.naukri.com/job-listings-python-developer-centralogic-pune-2-to-5-years-240125501359,"python, css, data analytics, natural language processing, python development, numpy, machine learning, artificial intelligence",3+ weeks ago
Python Developer,Cogent Soft Solution,Ahmedabad,2-4 Yrs,Cogent Soft Solution is looking for Python Developer to join our dynamic team and embar...,https://www.naukri.com/job-listings-python-developer-cogent-soft-solution-ahmedabad-2-to-4-years-200225503756,"python, css, software testing, natural language processing, python development, machine learning, artificial intelligence, javascript",3+ weeks ago
Python Developer,Appzlogic,"Pune, Kolkata, Mumbai, New Delhi, Hyderabad, Chennai, Bengaluru",0-3 Yrs,Appzlogic Mobility Solutions Pvt Ltd is looking for Python Developer to join our dynami...,https://www.naukri.com/job-listings-python-developer-appzlogic-mobility-solutions-pvt-ltd-kolkata-mumbai-new-delhi-hyderabad-pune-chennai-bengaluru-0-to-3-years-121124502854,"python, css, c, software testing, natural language processing, python development, machine learning, artificial intelligence",3+ weeks ago
Python Developer,MWB Technologies,"Pune, Kolkata, Mumbai, New Delhi, Hyderabad, Chennai, Bengaluru",2-6 Yrs,MWB Technologies is looking for Python Developer to join our dynamic team and embark on...,https://www.naukri.com/job-listings-python-developer-mwb-technologies-kolkata-mumbai-new-delhi-hyderabad-pune-chennai-bengaluru-2-to-6-years-041024501749,"python, css, c, software testing, natural language processing, python development, machine learning, artificial intelligence",3+ weeks ago
Python Software Developer,Softcell Technologies,"Thane, Navi Mumbai, Mumbai (All Areas)",3-7 Yrs,"Education : Bachelors degree in Computer Science, Engineering, or a related field. Expe...",https://www.naukri.com/job-listings-python-software-developer-softcell-technologies-thane-navi-mumbai-mumbai-all-areas-3-to-7-years-310525014878,"SQL, NoSQL, Selenium, Regular Expressions, Problem Solving Skills, Scrapy, Numpy, Rabbitmq",2 days ago
Developer AI Center of Excellence,IBM,Bengaluru,2-7 Yrs,2+ years of relevant industry experience. Proficiency in Python and experience in devel...,https://www.naukri.com/job-listings-developer-ai-center-of-excellence-ibm-india-pvt-limited-bengaluru-2-to-7-years-040725929434,"python, machine learning, deep learning, tensorflow, pytorch, image processing, natural language processing, scikit-learn",1 day ago
Python Software Developer,Macmillan Publishers India Pvt Ltd.,Noida,4-7 Yrs,"Bachelors degree in Computer Science, Engineering, or related field (or equivalent work...",https://www.naukri.com/job-listings-python-software-developer-macmillan-publishers-india-pvt-ltd-noida-4-to-7-years-030725017274,"Django, Python, GIT, Docker, Pandas, Flask, Software, Software development",2 days ago
Python Developer,Luxoft,Pune,4-9 Yrs,Project description We are looking for an experienced technical developer to work for o...,https://www.naukri.com/job-listings-python-developer-luxoft-india-llp-pune-4-to-9-years-120625933924,"rest, python, pandas, django, flask, kubernetes, openshift, orm libraries",3 weeks ago
Python Developer,Wipro,Hyderabad,2-6 Yrs,The purpose of this role is to develop minimum viable product (MVP) and comprehensive A...,https://www.naukri.com/job-listings-python-developer-wipro-limited-hyderabad-2-to-6-years-250625930457,"sql, python, python development, django framework, flask, css, django rest api, numpy",1 week ago
Python Developer,Abym Technology,Noida,3-8 Yrs,AbyM Technology is looking for Python Developer to join our dynamic team and embark on ...,https://www.naukri.com/job-listings-python-developer-abym-technology-noida-3-to-8-years-300625501950,"python, css, c, software testing, natural language processing, python development, machine learning, artificial intelligence",5 days ago
Python Developer,Diverse Lynx,Bengaluru,2-7 Yrs,Diverse Lynx is looking for Python Developer to join our dynamic team and embark on a r...,https://www.naukri.com/job-listings-python-developer-diverse-lynx-bengaluru-2-to-7-years-280625501175,"python, css, c, software testing, natural language processing, python development, machine learning, artificial intelligence",1 week ago
Python Developer,Diverse Lynx,Chennai,2-7 Yrs,Diverse Lynx is looking for Python Developer to join our dynamic team and embark on a r...,https://www.naukri.com/job-listings-python-developer-diverse-lynx-chennai-2-to-7-years-280625501174,"python, css, c, software testing, natural language processing, python development, machine learning, artificial intelligence",1 week ago
Python Developer,Igeektech,Surat,1-3 Yrs,iGeek is looking for Python Developer to join our dynamic team and embark on a rewardin...,https://www.naukri.com/job-listings-python-developer-igeek-surat-1-to-3-years-280625500415,"python, css, c, software testing, natural language processing, python development, machine learning, artificial intelligence",1 week ago
Python Developer,GLOINNT,Bengaluru,4-7 Yrs,GLOINNT is looking for Python Developer to join our dynamic team and embark on a reward...,https://www.naukri.com/job-listings-python-developer-gloinnt-bengaluru-4-to-7-years-010725502920,"python, css, c, software testing, natural language processing, python development, machine learning, artificial intelligence",4 days ago
Senior Python Developer,Web Minds It Solution,"Pune, Hyderabad, Bengaluru",4-9 Yrs,Location: Pune. Job Type: Full Time. The ideal candidate will possess a strong command ...,https://www.naukri.com/job-listings-senior-python-developer-web-minds-it-solution-hyderabad-pune-bengaluru-4-to-9-years-160625015061,"Ci/Cd, Machine Learning, Python, Deep Learning, Django, Tensorflow, Python Framework, Cloud Platforms",2 weeks ago
Machine Learning Engineer,Arealis Networks Pvt. Ltd.,Pune(Sadashiv Peth),2-6 Yrs,"As Lead ML Engineer, you'll lead the development of predictive models for demand forec...",https://www.naukri.com/job-listings-machine-learning-engineer-arealis-networks-pvt-ltd-pune-2-to-6-years-180625020750,"Scikit-Learn, Tensorflow, Data Engineering, Aws Cloud, Lstm, Machine Learning, Deep Learning, Data Bricks",2 weeks ago
Python Developer,Leading Client,Mumbai,4-6 Yrs,"Develop and maintain applications using Python, focusing on building scalable, efficien...",https://www.naukri.com/job-listings-python-developer-teamware-solutions-a-division-of-quantum-leap-co-nsulting-private-ltd-mumbai-4-to-6-years-260625938801,"python, data analysis, python development, django, web development, css, natural language processing, numpy",1 week ago
Python Developer,Leading Client,"India, India",4-5 Yrs,"Design and develop software applications using Python, focusing on backend services, da...",https://www.naukri.com/job-listings-python-developer-teamware-solutions-a-division-of-quantum-leap-co-nsulting-private-ltd-india-india-4-to-5-years-260625938719,"python, data processing, python development, django, flask, css, c, natural language processing",1 week ago
Python Developer,Triad Square Infotec,"Hyderabad, Chennai, Bengaluru",3-5 Yrs,Triad Square Infotec Pvt Ltd is looking for Python Developer to join our dynamic team a...,https://www.naukri.com/job-listings-python-developer-triad-square-infotec-pvt-ltd-hyderabad-chennai-bengaluru-3-to-5-years-270625500182,"python, css, software testing, natural language processing, python development, machine learning, artificial intelligence, javascript",1 week ago
Python Developer,Diverse Lynx,Hyderabad,4-6 Yrs,Diverse Lynx is looking for Python Developer to join our dynamic team and embark on a r...,https://www.naukri.com/job-listings-python-developer-diverse-lynx-hyderabad-4-to-6-years-240625503173,"python, css, c, software testing, natural language processing, python development, machine learning, artificial intelligence",1 week ago
Python Developer,Diverse Lynx,Bengaluru,4-6 Yrs,Diverse Lynx is looking for Python Developer to join our dynamic team and embark on a r...,https://www.naukri.com/job-listings-python-developer-diverse-lynx-bengaluru-4-to-6-years-240625503172,"python, css, c, software testing, natural language processing, python development, machine learning, artificial intelligence",1 week ago
Python Developer,Leading Client,India,4-5 Yrs,"Design and implement Python-based applications, focusing on system automation, data pro...",https://www.naukri.com/job-listings-python-developer-teamware-solutions-a-division-of-quantum-leap-co-nsulting-private-ltd-india-4-to-5-years-260625939645,"python, data processing, python development, django, web development, css, c, natural language processing",1 week ago
Python Developer,Comvision,"Pune, Navi Mumbai, Gurugram",5-8 Yrs,ualifications . Bachelors or Masters degree in Computer Science or related field The id...,https://www.naukri.com/job-listings-python-developer-comvision-india-pvt-ltd-navi-mumbai-pune-gurugram-5-to-8-years-250625017315,"python developer, rest api, numpy panda, Mongo db, redis, SQL, Rabbit mq, django",1 week ago
AI / Python Djongo Developer,Ingenious Minds Lab,Ahmedabad,3-8 Yrs,"Experience with libraries and frameworks like TensorFlow, PyTorch, Scikit-learn, or sim...",https://www.naukri.com/job-listings-ai-python-djongo-developer-ingeniousmindslab-solution-pvt-ltd-ahmedabad-3-to-8-years-120225503603,"Version control, GIT, Postgresql, Django, Artificial Intelligence, MySQL, Machine learning, Integration testing",3+ weeks ago
Python Developer @bfsi investment Banking,Net Connect,"Hybrid - Bengaluru, Mumbai (All Areas)",4-9 Yrs,"Required Technical Skills: . Education: Bachelors degree in Computer Science, Software ...",https://www.naukri.com/job-listings-python-developer-bfsi-investment-banking-net-connect-bengaluru-mumbai-all-areas-4-to-9-years-190225023776,"Django, Pandas, Python, Flask, Javascript, Numpy, Investment, Development",1 week ago
Machine Learning Engineer - midlevel,CapeStart,Nagercoil,2-6 Yrs,2+ years of ML + NLP experience. Experience working with structured and unstructured da...,https://www.naukri.com/job-listings-machine-learning-engineer-midlevel-capestart-software-private-limited-nagercoil-2-to-6-years-030725030485,"fundamentals, algorithms, analytical, software, scikit-learn, numpy, sql, docker",2 days ago
Python Software Developer,E Solutions It Services,"Hybrid - Hyderabad, Bangalore Rural, Bengaluru",7-12 Yrs,We're hiring for the role of Python Developer Job Title Python Developer AI/ML FocusExp...,https://www.naukri.com/job-listings-python-software-developer-e-solutions-hyderabad-bangalore-rural-bengaluru-7-to-12-years-040725019323,"python, Artificial Intelligence, Machine Learning, Tensorflow, Numpy, Scikit-Learn, SQL, Pytorch",1 day ago
Assistant Manager - Python Developer- MNC-Lower Parel,Shreesha Consultants,"Mumbai Suburban, Navi Mumbai, Mumbai (All Areas)",3-8 Yrs,Design implement Python AI/ML/Gen AI models algorithms &app Coordinate data scientists ...,https://www.naukri.com/job-listings-assistant-manager-python-developer-mnc-lower-parel-shreesha-consultants-mumbai-suburban-navi-mumbai-mumbai-all-areas-3-to-8-years-011024017313,"Al, Machine Learning, Gen AI, Cloud, Python, Data Engineering, Proof Of Concept, Natural Language Processing",1 week ago
Python Developer,Mindsprint,Hybrid - Chennai,3-6 Yrs,Required Skills & Qualifications: . Python Proficiency: Strong proficiency in Python an...,https://www.naukri.com/job-listings-python-developer-mindsprint-chennai-3-to-6-years-260625031341,"pandas, python, numpy, SQL, Snowflake, AWS, azure, Microsoft Azure",1 week ago
AI/ML Developer Python,Seanergy Digital,Hybrid - Hyderabad,3-6 Yrs,"Proficient in Python x, OOP, and clean code principles Were looking for a Python-based ...",https://www.naukri.com/job-listings-ai-ml-developer-python-seanergy-digital-hyderabad-3-to-6-years-230625012489,"Python Development, Matplotlib, Django, Artificial Intelligence, Pandas, Fast Api, Aiml, Seaborn",1 week ago
Python Developer | Leading FinTech | Bangalore,Perfios Software Solutions,Hybrid - Bengaluru,2-4 Yrs,Primary FunctionHands on in Python scripting language.A deep understanding of Data str...,https://www.naukri.com/job-listings-python-developer-leading-fintech-bangalore-perfios-software-solutions-bengaluru-2-to-4-years-200625030650,"Java, Numphy, Mysql, Pandas, Python, Django, Development, Fintech",2 weeks ago
Urgent Opening For Sr.Python Developer,Geotech Infoservices,Kolkata,4-9 Yrs,We are looking for a passionate Senior Python developer to join our team at GeoTech Inf...,https://www.naukri.com/job-listings-urgent-opening-for-sr-python-developer-geotech-infoservices-kolkata-4-to-9-years-300525036542,"Django, FastApi, Python, Flask, Rest Api Development, API, Rest, Development",1 day ago
Python Developer,Diverse Lynx,Hyderabad,2-7 Yrs,"Required Qualifications: . Bachelors degree in Computer Science, Engineering, or a rela...",https://www.naukri.com/job-listings-python-developer-diverse-lynx-hyderabad-2-to-7-years-040725502640,"Front end, Testing tools, Postgresql, MySQL, Javascript, HTML, Unit testing, SQL",1 day ago
Hiring For AI Developer,Acceltree Softwares,Pune,2-6 Yrs,We are seeking a Data Scientist with 2 to 5 years of experience to join our AI/ML tea...,https://www.naukri.com/job-listings-hiring-for-ai-developer-acceltree-softwares-pune-2-to-6-years-130225008081,"Generative AI, Chatbot, Machine Learning, Rasa, Python, Tensorflow, Artificial Intelligence, Natural Language Processing",3 weeks ago
Python Developer,TechKnowledgeHub.org,Remote,2-6 Yrs,Optimize application performance for maximum speed and scalabilityRequirements: . Bache...,https://www.naukri.com/job-listings-python-developer-techknowledgehub-org-remote-2-to-6-years-220424500462,"Front end, Coding, Postgresql, MySQL, Web development, Javascript, HTML, Internship",3+ weeks ago
Sr. AI/ML Developer,Ecosmob Technologies,Ahmedabad,2-5 Yrs,Version Control: Proficient understanding of Git and Bitbucket for software version con...,https://www.naukri.com/job-listings-sr-ai-ml-developer-ecosmob-technologies-pvt-ltd-ahmedabad-2-to-5-years-180325506303,"C++, Multithreading, Postgresql, MySQL, Debugging, SQLite, Machine learning, Monitoring",3+ weeks ago
Senior Python Developer,Turing Global India,Remote,3-7 Yrs,"Experience using AWS CloudFormation, Docker, and MicroServices architectures. Experienc...",https://www.naukri.com/job-listings-senior-python-developer-turing-remote-3-to-7-years-140125505137,"HP data protector, Linux, Coding, Postgresql, MySQL, JSON, Open source, JIRA",3+ weeks ago
Python AI developer,Ford,Chennai,3-8 Yrs,Strong knowledge on Python data structures and algorithms . Proficiency with Python and...,https://www.naukri.com/job-listings-python-ai-developer-ford-global-business-services-chennai-3-to-8-years-050725500793,"Computer science, Coding, Postgresql, Debugging, Machine learning, Data structures, Scrum, Troubleshooting",Few hours ago
Python AI developer,Ford,Chennai,3-8 Yrs,Strong knowledge on Python data structures and algorithms . Proficiency with Python and...,https://www.naukri.com/job-listings-python-ai-developer-ford-india-private-limited-chennai-3-to-8-years-050725500508,"Computer science, Coding, Postgresql, Debugging, Machine learning, Data structures, Scrum, Troubleshooting",Few hours ago
Python Developer,Emerson,Pune,1-6 Yrs,"In This Role, Your Responsibilities Will Be: Development of Data Analysis, Da...",https://www.naukri.com/job-listings-python-developer-emerson-innovation-center-pune-1-to-6-years-310525502369,"Object oriented design, System architecture, Data analysis, GIT, Linux, Machine learning, Debugging, test driven development",3+ weeks ago
AI/ML Developer,Vivansh Infotech,Ahmedabad,2-3 Yrs,Skills and requirements Proficiency in Python and experience with libraries such ...,https://www.naukri.com/job-listings-ai-ml-developer-vivansh-infotech-ahmedabad-2-to-3-years-310525502083,"Computer vision, deep learning, Basic, Logistic regression, Version control, GIT, Neural networks, data manipulation",3+ weeks ago
Python AI/ML Developer,Ergobite Tech Solutions,Pune,3-8 Yrs,"Bachelor s or Master s degree in Engineering, Computer Science, or a related field Mini...",https://www.naukri.com/job-listings-python-ai-ml-developer-ergobite-tech-solutions-pune-3-to-8-years-261124502997,"deep learning, Product engineering, Version control, GIT, IT consulting, Machine learning, Manager Technology, Natural language processing",3+ weeks ago
AI / ML Developer,Sonora Software,Pune,2-7 Yrs,"Bachelor s or Master s degree in Computer Science, Engineering, Mathematics, or a relat...",https://www.naukri.com/job-listings-ai-ml-developer-sonora-software-pvt-ltd-pune-2-to-7-years-211024503495,"Computer vision, Software development methodologies, Version control, GIT, Data management, Machine learning, Natural language processing, SQL",3+ weeks ago
Python AI/ML Developer,Rectitude Consulting Services,Pune,2-5 Yrs,Vacancy for Python AI/ML Developer Job Summary Short Profile : pydev123 Of Vacancy 2 Lo...,https://www.naukri.com/job-listings-python-ai-ml-developer-rectitude-consulting-services-pune-2-to-5-years-200525503145,"pytorch, python development, machine learning algorithmscommunication skills, aws, mongodb, artificial intelligence, Ml, Python",3+ weeks ago
Python Developer,Cleverground Technologies,Pune,3-8 Yrs,Preferred Experience . 3+ years of experience in backend development . Proficient in p...,https://www.naukri.com/job-listings-python-developer-cleverground-pune-3-to-8-years-131222501132,"C++, Software design, Backend, Web services, Django, Web development, Data structures, MongoDB",3+ weeks ago
Python Developer,Luxoft,Pune,4-9 Yrs,"Experience of working on Kubernetes / OpenShift, Dockers, Cloud Native frameworksMust h...",https://www.naukri.com/job-listings-python-developer-luxoft-pune-4-to-9-years-110625502491,"Computer science, Automation, Version control, Linux, Django, Shell scripting, Agile, Windows",3 weeks ago
Python Developer / Web Scraper,Hir Infotech,Ahmedabad,1-2 Yrs,Develop and maintain web scraping scripts using Python and Selenium to extract data fro...,https://www.naukri.com/job-listings-python-developer-web-scraper-hir-infotech-pvt-ltd-ahmedabad-1-to-2-years-100823500132,"Performance tuning, Automation, Coding, XML, MySQL, Data structures, HTML, microsoft",3+ weeks ago
Python Developer,Taashatech Infosolutions,Ahmedabad,1-6 Yrs,bachelors / master degree in Computer Science or relevant experience . 1+ years of expe...,https://www.naukri.com/job-listings-python-developer-taashatech-infosolutions-pvt-ltd-ahmedabad-1-to-6-years-090824502804,"Coding, Neural networks, Django, Analytical, Machine learning, Programming, Data structures, SQL",3+ weeks ago
Sr Software Developer - Python,Turing Global India,Remote,3-7 Yrs,"Bachelor s / Master s in Computer Science, Engineering, or related field . Job Requirem...",https://www.naukri.com/job-listings-sr-software-developer-python-turing-remote-3-to-7-years-050325504839,"Computer science, Analytical skills, Usage, NoSQL, GCP, Cloud, Manager Technology, AWS",3+ weeks ago
AI Python Developer,Excellent Webworld,Ahmedabad,3-8 Yrs,We are seeking a highly skilled and passionate AI Python Developer with 3+ years of e...,https://www.naukri.com/job-listings-ai-python-developer-excellent-webworld-ahmedabad-3-to-8-years-020525502084,"Data analysis, Version control, GIT, NoSQL, Machine learning, Data processing, Open source, SQL",3+ weeks ago
Python Software Developer,Quantum Leap Consulting,Hybrid - Mumbai (All Areas),3-8 Yrs,Shift : General Shifts. Interview Mode : 1st Round Virtual and 2nd Round F2fOpenings fo...,https://www.naukri.com/job-listings-python-software-developer-teamware-solutions-a-division-of-quantum-leap-co-nsulting-mumbai-all-areas-3-to-8-years-250625934928,"Pandas, Python Development, SQL, SQL Queries, Numpy, Development, Python, Query",1 week ago
Python developer with neo4j cypher skills,Keytag Labs,Remote,3-7 Yrs,Core Skills Required Desirable (but not required youll gain experience here)Solid exper...,https://www.naukri.com/job-listings-python-developer-with-neo4j-cypher-skills-keytag-labs-chennai-3-to-7-years-130525003639,"Neo4J, Python, webservices, Web services, Development",2 days ago
