Title,Company,Location,Experience,Description,Apply Link,Tags,Posted
Python Developer,Leading Client,Pune,3-5 Yrs,"Education : BE in CS / IT, MSc CS, MCS, MCA ScienceResponsibilities :- Design, develop,...",https://www.naukri.com/job-listings-python-developer-basebiz-pune-3-to-5-years-030725916616,"Python, REST API, PostgreSQL, Django, MySQL, SQLite, ORM, AWS",2 days ago
Python Developer,Coditas Technologies,Hybrid - Pune,3-6 Yrs,Proven experience of 2-3 years as a Python developerexperience with one or more Python ...,https://www.naukri.com/job-listings-python-developer-coditas-technologies-pune-3-to-6-years-290525026070,"Django, Rest Api Development, Fast Api, Flask, Python, Azure Cloud, AWS, Machine Learning",2 days ago
Data Engineer,Capgemini,"Pune, Hyderabad, Bengaluru",4-9 Yrs,Job Description:Position: Data Engineer Location: Pan India Company: Capgemini Experie...,https://www.naukri.com/job-listings-data-engineer-capgemini-hyderabad-pune-bengaluru-4-to-9-years-040725019908,"Pyspark, Azure, AWS, Python, ETL, Microsoft Azure, Data Engineering, Data",1 day ago
Data Engineer,Coditas Technologies,Pune,2-6 Yrs,Minimum 2 years of progressive experience building solutions in Big Data environments,https://www.naukri.com/job-listings-data-engineer-coditas-technologies-pune-2-to-6-years-220525013411,"Pyspark, Azure Cloud, AWS, Python, SQL, Data Warehousing, Data Modeling, Warehouse",2 days ago
Sr Data Engineer,Hoffmann La Roche,Pune,3-5 Yrs,We are seeking a dynamic and experienced Technical Data Lead with SME-level knowledge i...,https://www.naukri.com/job-listings-sr-data-engineer-hoffmann-la-roche-pune-3-to-5-years-030725503743,"ERP, Data modeling, CMS, Agile, Engineering Manager, Healthcare, AWS, CRM",2 days ago
Dev Ops Engineer,Emerson,Pune,3-5 Yrs,"In this Role, Your Responsibilities Will Be: Responsible for installer bundle creati...",https://www.naukri.com/job-listings-dev-ops-engineer-emerson-innovation-center-pune-3-to-5-years-040725500942,"Computer science, Linux, Networking, Agile development, Cloud, Performance testing, Infrastructure, MongoDB",1 day ago
AWS Python Data Engineer -Virtual Interview-28th June,EY,"Hybrid - Pune, Chennai, Bengaluru",3-7 Yrs,"Hi, Urgent opening for AWS Python Data Engineer with EY GDS at Pan India Location.EXP :...",https://www.naukri.com/job-listings-aws-python-data-engineer-virtual-interview-28th-june-ey-pune-chennai-bengaluru-3-to-7-years-210625015633,"Pyspark, AWS, Python, SQL, Python Data, Data",2 weeks ago
Aws Data Engineer,Hiring for Leading MNC Company,"Hybrid - Pune, Hyderabad, Bengaluru",4-6 Yrs,Experience Required :4 to 6 yrs . Work Location :Bangalore / Pune/Hyderabad / Chennai R...,https://www.naukri.com/job-listings-aws-data-engineer-sp-staffing-hyderabad-pune-bengaluru-4-to-6-years-030725020869,"Pyspark, Glue, python, EMR, Aws Glue, Lambda Aws, Aws Emr, AWS Data Engineer",2 days ago
Aws Data Engineer,Hiring for Leading MNC Company,"Hybrid - Pune, Hyderabad, Bengaluru",4-6 Yrs,Experience Required :4 to 6 yrs . Work Location :Bangalore / Pune/Hyderabad / Chennai R...,https://www.naukri.com/job-listings-aws-data-engineer-sp-staffing-hyderabad-pune-bengaluru-4-to-6-years-050725011894,"Pyspark, Glue, python, EMR, Aws Glue, Lambda Aws, Aws Emr, AWS Data Engineer",Today
Developer - Data cloud,Wipro,Pune,2-7 Yrs,"Performance Parameter . Measure Continuous Integration, Deployment & Monitoring of Soft...",https://www.naukri.com/job-listings-developer-data-cloud-wipro-limited-pune-2-to-7-years-250625928991,"continuous integration, cloud development, root cause analysis, software development life cycle, mis, kubernetes, python, microsoft azure",1 week ago
Sr Python Developer â€“ (AI Applications),UKG,Pune,2-7 Yrs,"Company Overview With 80, 000 customers across 150 countries, UKG is the largest U.S.-...",https://www.naukri.com/job-listings-sr-python-developer-ai-applications-kronos-solutions-india-pvt-ltd-pune-2-to-7-years-260625924247,"continuous integration, software development, ci/cd, java, aws, c#, python, github",1 week ago
Cloud Cost Estimation Analyst,Deutsche Bank,Pune,3-7 Yrs,"Bachelors degree in finance, accounting, computer science, or a related fieldExperience...",https://www.naukri.com/job-listings-cloud-cost-estimation-analyst-deutsche-bank-ag-pune-3-to-7-years-260625910513,"financial analysis, google sheets, gcp, cost management, pricing, hlookup, conditional formatting, macros",1 week ago
Data Engineer,E.L.F BEAUTY INDIA PRIVATE LIMITED,Ahmedabad,1-4 Yrs,"About the Company e.l.f. Beauty, Inc. stands with every eye, lip, face and paw. Our d...",https://www.naukri.com/job-listings-data-engineer-e-l-f-beauty-india-private-limited-ahmedabad-1-to-4-years-260625030993,"modeling, analytical, data, standardization, data warehousing, cleansing, sql, coding",1 week ago
Sr. Data Engineer,E.L.F BEAUTY INDIA PRIVATE LIMITED,Ahmedabad,2-6 Yrs,"About the Company e.l.f. Beauty, Inc. stands with every eye, lip, face and paw. Our d...",https://www.naukri.com/job-listings-sr-data-engineer-e-l-f-beauty-india-private-limited-ahmedabad-2-to-6-years-260625030648,"modeling, analytical, data, standardization, data warehousing, cleansing, sql, coding",1 week ago
Data Engineer,Jade Global,Pune,2-6 Yrs,"Data Engineer1 Common Skils - SQL, GCP BQ, ETL pipelines using Pythin/Airflow, Experien...",https://www.naukri.com/job-listings-data-engineer-jade-global-software-pvt-ltd-pune-2-to-6-years-240625930031,"hive, sql, data modeling, spark, etl, scala, amazon redshift, pyspark",1 week ago
AI Devops Consultant,Oracle,"Pune, Kolkata, Mumbai, New Delhi, Hyderabad, Chennai, Bengaluru",3-5 Yrs,"Bachelor s / Master s in Computer Science, AI, Data Science, or related fields. AI / ML...",https://www.naukri.com/job-listings-ai-devops-consultant-oracle-india-pvt-ltd-kolkata-mumbai-new-delhi-hyderabad-pune-chennai-bengaluru-3-to-5-years-030725503035,"Computer science, Computer vision, NoSQL, Postgresql, Analytical, Machine learning, MongoDB, Oracle",2 days ago
Lead Software Engineer,UKG,Pune,4-9 Yrs,"Company Overview With 80, 000 customers across 150 countries, UKG is the largest U.S.-b...",https://www.naukri.com/job-listings-lead-software-engineer-kronos-solutions-india-pvt-ltd-pune-4-to-9-years-260625924305,"continuous integration, software development, version control, java, design patterns, c#, python, github",1 week ago
Lead Software Engineer-AI,UKG,Pune,4-9 Yrs,"Tens of millions of frontline workers start and end their days with our software, with ...",https://www.naukri.com/job-listings-lead-software-engineer-ai-kronos-solutions-india-pvt-ltd-pune-4-to-9-years-260625924231,"continuous integration, java, design patterns, software development, version control, c++, unit testing, ci/cd",1 week ago
Full Stack Python Developer-Male Candidates only,AM Infoweb,Pune(Kalyani Nagar),2-7 Yrs,"Education: Bachelors degree in Computer Science, Engineering, or a related field, or eq...",https://www.naukri.com/job-listings-full-stack-python-developer-male-candidates-only-am-infoweb-pune-2-to-7-years-080425022109,"Django, CSS, Fast Api, Javascript, HTML, AWS, Flask, Python",4 days ago
Python AWS Developer,Systechcorp Inc,"Pune, Kolkata, Mumbai, New Delhi, Hyderabad, Chennai, Bengaluru",2-7 Yrs,Infrastructure as Code: Strong experience with Terraform for provisioning and managing ...,https://www.naukri.com/job-listings-python-aws-developer-systechcorp-inc-kolkata-mumbai-new-delhi-hyderabad-pune-chennai-bengaluru-2-to-7-years-220125502178,"GIT, Version control, Cloud, Programming, Manager Technology, Troubleshooting, big data, AWS",3+ weeks ago
Data Engineer,Global Banking Organization,Hybrid - Pune,4-7 Yrs,Eagerness for continuous learning and staying up-to-date with technology trends. Educat...,https://www.naukri.com/job-listings-data-engineer-careernet-pune-4-to-7-years-040725011753,"GIT, AWS Cloud Services, Snowflake Data Cloud, AWS, Matillion AND GIT/GIT HUB + Jenkins, Hub, Snowflake, Cloud Services",1 day ago
Data Engineer,Leading Client,"Pune, Kolkata, Chennai",4-6 Yrs,To create new Rules using SparkSQL based on written requirements. . Must Have Skills: U...,https://www.naukri.com/job-listings-data-engineer-iospl-technology-services-private-limited-kolkata-pune-chennai-4-to-6-years-200625930198,"Data Engineering, Polars Library, Java, Data Quality, Azure, GCP, SparkSQL, AWS",2 weeks ago
GenAI - Data Engineer,CitiusTech,Pune,3-5 Yrs,Skills: -Mandatory Technical Skills: - * Strong knowledge Python and SQL and PL / SQL *...,https://www.naukri.com/job-listings-genai-data-engineer-citiustech-pune-3-to-5-years-040725503971,"Product management, IT services, Cloud computing, Coding, Consulting, Agile, PLSQL, Healthcare",1 day ago
"Senior Data Engineer, Actimize",Atlasrtx,Pune,4-6 Yrs,"Within Actimize, the AI and Analytics Team is developing the next generation advanced a...",https://www.naukri.com/job-listings-senior-data-engineer-actimize-atlasrtx-pune-4-to-6-years-030725500316,"Computer science, data security, Analytical, PAAS, Machine learning, Flex, Data quality, SQL",2 days ago
Python AWS Developer,Apptad,Pune,6-8 Yrs,We are looking for a skilled Python AWS Developer with 6 to 8 years of experienceExperi...,https://www.naukri.com/job-listings-python-aws-developer-apptad-technologies-pvt-ltd-pune-6-to-8-years-300625913495,"python, aws stack, amazon ec2, lambda expressions, aws, kubernetes, aws iam, dynamo db",5 days ago
Cloud Developer,Leading Client,Ahmedabad,3-6 Yrs,"The ideal candidate has experience in cloud computing, software development, and system...",https://www.naukri.com/job-listings-cloud-developer-mantrras2success-hr-solutions-llp-ahmedabad-3-to-6-years-020725930339,"continuous integration, ci/cd, javascript, typescript, aws, kubernetes, python, amazon vpc",3 days ago
Data Engineer,The Lifetime Value Co,"Pune, Kolkata, Mumbai, New Delhi, Hyderabad, Chennai, Bengaluru",1-2 Yrs,"About the Job The Lifetime Value Co. is looking for a Data Engineer to help us build, ...",https://www.naukri.com/job-listings-data-engineer-the-lifetime-value-co-kolkata-mumbai-new-delhi-hyderabad-pune-chennai-bengaluru-1-to-2-years-020725505762,"github, Version control, GIT, orchestration, Analytical, JSON, Scheduling, Continuous improvement",3 days ago
Data Engineer,S&P Global Market Intelligence,"Ahmedabad, Hyderabad, Gurugram",2-6 Yrs,"Integrate and deploy machine learning models into those pipelines (e.g., inference serv...",https://www.naukri.com/job-listings-data-engineer-sp-capital-iq-india-pvt-ltd-hyderabad-ahmedabad-gurugram-2-to-6-years-010725924325,"python, dynamo db, amazon rds, lambda expressions, aws, continuous integration, kubernetes, rest",4 days ago
"Engineer - DevOps, AS",Deutsche Bank,Pune,3-7 Yrs,Bachelors degree in Computer Science / Engineering or relevant technology & science Mus...,https://www.naukri.com/job-listings-engineer-devops-as-deutsche-bank-ag-pune-3-to-7-years-300625904848,"continuous integration, devops, perl, python, ci cd pipeline, kubernetes, golang, ci/cd",5 days ago
Big Data Engineer,Krazy Mantra It,"Pune, Kolkata, Mumbai, New Delhi, Hyderabad, Chennai, Bengaluru",4-9 Yrs,Krazy Mantra Group of Companies is looking for Big Data Engineer to join our dynamic te...,https://www.naukri.com/job-listings-big-data-engineer-krazy-mantra-group-of-companies-kolkata-mumbai-new-delhi-hyderabad-pune-chennai-bengaluru-4-to-9-years-280625500419,"hive, cloudera, scala, apache storm, apache pig, sql, apache, java",1 week ago
Full Stack Solution Engineer,BMC Software,Pune,3-6 Yrs,". To ensure youre set up for success, you will bring the following skillset & experienc...",https://www.naukri.com/job-listings-full-stack-solution-engineer-bmc-software-india-pvt-ltd-pune-3-to-6-years-010725916530,"algorithms, presentation skills, java, full stack, data structures, rest, css, python",4 days ago
Senior Data Engineer,Go Digital Technology Consulting,"Hybrid - Pune, Mumbai",3-8 Yrs,Role: Senior Data Engineer Location: Mumbai & PuneExperience: 3yrs to 8yrs Technologies...,https://www.naukri.com/job-listings-senior-data-engineer-go-digital-technology-consulting-llp-mumbai-pune-3-to-8-years-300625015350,"Pyspark, Python, SQL, Hadoop, Big Data, Kafka, Spark, AWS",5 days ago
Data Engineer - Pune,Vantageiq Technologies Opc,Pune,2-4 Yrs,Proficiency in both RDBMS (Mysql preferred) and NoSql datastores Preferred candidate pr...,https://www.naukri.com/job-listings-data-engineer-pune-vantageiq-technologies-opc-pune-2-to-4-years-061124004570,"Pyspark, Glue, Aws Glue, Python, Big Data, ETL, Data Governance, Data Engineering",4 days ago
Senior Data Engineer,S&P Global Market Intelligence,"Ahmedabad, Hyderabad, Gurugram",4-8 Yrs,"Integrate, deploy, and scale ML models within those pipelines (real-time inference and ...",https://www.naukri.com/job-listings-senior-data-engineer-sp-capital-iq-india-pvt-ltd-hyderabad-ahmedabad-gurugram-4-to-8-years-010725924329,"continuous integration, kubernetes, ci/cd, python, aws, eks, redis, sql",4 days ago
Aws Data Engineer,Genpact,"Hybrid - Pune, Hyderabad, Bengaluru",4-7 Yrs,We are inviting applications for the role of Data Engineer Extensive hands-on experien...,https://www.naukri.com/job-listings-aws-data-engineer-genpact-hyderabad-pune-bengaluru-4-to-7-years-010725013479,"Pyspark, AWS, Python, Data",4 days ago
"Data Engineer (Python, AWS services (kafka, hadoop, spark))",Turing Global India,Remote,3-5 Yrs,Experience with batch processing data and / or creating real-time analysis systems . Hi...,https://www.naukri.com/job-listings-data-engineer-python-aws-services-kafka-hadoop-spark-turing-remote-3-to-5-years-140125508039,"Social media marketing, Mechatronics, Front end, Version control, GIT, Machine learning, SCALA, biomedical",3+ weeks ago
Aws Data Engineer,Hiring for Leading MNC Company,"Hybrid - Pune, Hyderabad, Bengaluru",4-6 Yrs,Experience Required :4 to 6 yrs . Work Location :Bangalore / Pune/Hyderabad / Chennai R...,https://www.naukri.com/job-listings-aws-data-engineer-sp-staffing-hyderabad-pune-bengaluru-4-to-6-years-300625001849,"Pyspark, Glue, python, EMR, Aws Glue, Aws Emr, AWS Data Engineer, Aws Lambda",5 days ago
Python Developer,Dynamic Vishva,Remote,1-3 Yrs,DYNAMIC VISHVA is looking for Python Developer to join our dynamic team and embark on a...,https://www.naukri.com/job-listings-python-developer-dynamic-vishva-remote-1-to-3-years-200625500846,"python, css, c, software testing, natural language processing, python development, machine learning, artificial intelligence",2 weeks ago
Data Engineer,Bestpeers Infosystem,Indore,1-3 Yrs,a Masters is a plusExperience Required:-Previous experience as a data engineer or in a ...,https://www.naukri.com/job-listings-data-engineer-bestpeers-infosystem-indore-1-to-3-years-260625030481,"ETL Tool, Pyspark, Azure Cloud, Postgresql, Pandas, Django Framework, AWS, Numpy",1 week ago
ETL Data Engineer – Python/ AWS/ SQL,Wits Innovation Lab,Bengaluru,6-11 Yrs,"We are looking for energetic, self-motivated and exceptional Data engineer to work on e...",https://www.naukri.com/job-listings-etl-data-engineer-python-aws-sql-wits-innovation-lab-bengaluru-6-to-11-years-040725924829,"Python, RDS, BI Tools, SAS, DynamoDB, FHIR, Redshift, SQL",1 day ago
"Software Engineer - (Python, AWS)",Tapad,Hyderabad,3-8 Yrs,You will have hands-on experience with AIOboto3 and an understanding of building scalab...,https://www.naukri.com/job-listings-software-engineer-python-aws-tapad-hyderabad-3-to-8-years-270625503042,"Computer science, Backend, NoSQL, Stock exchange, Healthcare, Wellness, Automotive, Financial services",1 week ago
"Associate Software Engineer - Python, AWS",Reuters,Bengaluru,0-3 Yrs,bachelors in computer science or equivalent work experience. Make an impact in your com...,https://www.naukri.com/job-listings-associate-software-engineer-python-aws-reuters-news-agency-bengaluru-0-to-3-years-250625504447,"Computer science, Career development, Analytical, Consulting, Debugging, Agile, Flex, Application development",1 week ago
Software Engineer III- AI/ML Python & AWS,JPMorgan Chase Bank,Bengaluru,0-6 Yrs,"As a Software Engineer III at JPMorgan Chase within the Employee Platforms team, you...",https://www.naukri.com/job-listings-software-engineer-iii-ai-ml-python-aws-jp-morgan-chase-bengaluru-0-to-6-years-200625501275,"remediation, Front end, Linux, Debugging, Agile, Data structures, Risk management, Monitoring",2 weeks ago
Data Engineer,Acenet,"Pune, Noida, Hyderabad, Gurugram, Bengaluru",4-6 Yrs,"Hands-on experience with Databricks Unity Catalog, Federated Catalog, and Infrastructur...",https://www.naukri.com/job-listings-data-engineer-acenet-noida-hyderabad-pune-gurugram-bengaluru-4-to-6-years-010725501885,"Supply chain, Computer science, Version control, GIT, data security, Healthcare, Financial services, SQL",4 days ago
Senior Data Engineer,Savii,Remote,4-8 Yrs,Develop modular and reusable workflows for both batch and streaming data processing usi...,https://www.naukri.com/job-listings-senior-data-engineer-savii-remote-4-to-8-years-280625503108,"Performance tuning, Data modeling, Coding, MySQL, Debugging, Agile, Analytics, Monitoring",1 week ago
Python AWS developer,Virtusa,Pune,7-12 Yrs,"To be successful in this role, you should meet the following requirements: Extensive ex...",https://www.naukri.com/job-listings-python-aws-developer-virtusa-consulting-services-pvt-ltd-pune-7-to-12-years-270625921518,"java development, spring, java, automation tools, scripting languages, automation framework, continuous integration, kubernetes",1 week ago
Python Developer,Leading Client,Pune,3-5 Yrs,"Duration - 3 months ( 80% possibility, it will be extended). Notice - Immediate, the ca...",https://www.naukri.com/job-listings-python-developer-basebiz-private-limited-pune-3-to-5-years-230625914620,"Python, REST API, CSS, PostgreSQL, Django, MySQL, SQLite, JavaScript",1 week ago
"API / Data Engineer (Python, PosgreSQL, API's, AWS)",Turing Global India,Remote,3-7 Yrs,"Experience with Python, PostgreSQL, API engineering, and AWS. Strong knowledge of SQLAl...",https://www.naukri.com/job-listings-api-data-engineer-python-posgresql-api-s-aws-turing-remote-3-to-7-years-140125507551,"Interpersonal skills, Investment research, Postgresql, market data, Management, AWS, Python, Investment",3+ weeks ago
AWS Developer,Persistent,Pune,4-8 Yrs,"We invite applications from all qualified individuals, including those with disabilitie...",https://www.naukri.com/job-listings-aws-developer-persistent-systems-limited-pune-4-to-8-years-161024023157,"continuous integration, kubernetes, ci/cd, tools, helm, containerization, cloud, git",1 week ago
Python Senior Developer,Infosys,Pune,3-5 Yrs,"Bachelor of Engineering, BTech, BSc, BCA, MSc, MCA, MTech . Service Line Preferred . Go...",https://www.naukri.com/job-listings-python-senior-developer-infosys-limited-pune-3-to-5-years-270625922088,"python, performance engineering, agile, sdlc, agile methodology, css, data validation, test cases",1 week ago
Senior Data Scraping Engineer,Vinculum Solutions,"Ahmedabad, Gandhinagar, Bengaluru",3-7 Yrs,"The ideal candidate will have 8-10 years of experience in ethical web scraping, includi...",https://www.naukri.com/job-listings-senior-data-scraping-engineer-vinculum-solutions-gandhinagar-ahmedabad-bengaluru-3-to-7-years-240625013885,"Scrapy, Data Scraping Engineer, Scraping Engineer, Data Engineer, Python, Bright Data, Node.Js, Apache",1 week ago
Data Engineer,NPS Prism,"Pune, Kolkata, Mumbai, New Delhi, Hyderabad, Chennai, Bengaluru",3-6 Yrs,"Bachelor s or Master s degree in Computer Science, Information Technology, Engineering,...",https://www.naukri.com/job-listings-data-engineer-nps-prism-kolkata-mumbai-new-delhi-hyderabad-pune-chennai-bengaluru-3-to-6-years-280625500828,"Computer science, Automation, Version control, Data management, Data processing, Data quality, Information technology, Distribution system",1 week ago
Data Engineer,Eclinical Solutions,"Pune, Kolkata, Mumbai, New Delhi, Hyderabad, Chennai, Bengaluru",3-8 Yrs,Bachelors degree or equivalent experience preferred . Experience in Microsoft Office Ap...,https://www.naukri.com/job-listings-data-engineer-eclinical-solutions-llc-kolkata-mumbai-new-delhi-hyderabad-pune-chennai-bengaluru-3-to-8-years-280625500799,"Business objects, Db2, Cognos, Datastage, SSRS, PLSQL, HTML, Informatica",1 week ago
Data Engineer,Honeybee Tech Solutions,Pune,3-6 Yrs,"Interview Mode: Face to Face Only Experience with big data technologies like Hadoop, an...",https://www.naukri.com/job-listings-data-engineer-honeybee-tech-solutions-pune-3-to-6-years-020725020003,"SQL, Data Engineering, PYSPARK, PYTHON, Engineering, Data",3 days ago
Python + AWS Developer,Xtag Services,Remote,8-13 Yrs,Proficiency in Infrastructure as Code using Terraform and CDK for TerraformProven exper...,https://www.naukri.com/job-listings-python-aws-developer-xtag-services-remote-8-to-13-years-210625500211,"Backend, Architecture, Cloud, Active directory, Infrastructure, Deployment, AWS, Python",2 weeks ago
DevOps Engineer II,Datarobot,Remote,3-6 Yrs,Job Description: DataRobot delivers AI that maximizes impact and minimizes bu...,https://www.naukri.com/job-listings-devops-engineer-ii-datarobot-remote-3-to-6-years-300625501747,"Computer science, Administration, Cloud computing, Automation, Networking, Debugging, Machine learning, Infrastructure",5 days ago
Python Developer,Sourcefuse Technologies,"Pune, Kolkata, Mumbai, New Delhi, Hyderabad, Chennai, Bengaluru",1-2 Yrs,"Job Type: FULL TIME Bachelor s degree in Computer Science, Software Engineering, or a r...",https://www.naukri.com/job-listings-python-developer-sourcefuse-technologies-india-pvt-ltd-kolkata-mumbai-new-delhi-hyderabad-pune-chennai-bengaluru-1-to-2-years-010725502415,"IT services, Computer science, System architecture, Data modeling, Coding, Debugging, Agile, Unit testing",4 days ago
Data Engineer - AWS + Python,Fractal Analytics,"Pune, Noida, Mumbai, Chennai, Gurugram, Bengaluru",3-5 Yrs,"As a Data Engineer, you will be responsible implementing complex data pipelines an...",https://www.naukri.com/job-listings-data-engineer-aws-python-fractal-analytics-ltd-noida-mumbai-pune-chennai-gurugram-bengaluru-3-to-5-years-150425502694,"Computer vision, customer analytics, Machine learning, Data analytics, Apache, AWS, Analytics, SQL",3+ weeks ago
Data Engineer _ AWS + Python,Neal Analytics,"Pune, Noida, Mumbai, Chennai, Gurugram, Bengaluru",3-5 Yrs,"Experience implementing Redshift on AWS or any one of Databricks on AWS, or Snowflake o...",https://www.naukri.com/job-listings-data-engineer-aws-python-neal-analytics-noida-mumbai-pune-chennai-gurugram-bengaluru-3-to-5-years-150425501866,"Computer vision, customer analytics, Machine learning, Data analytics, Apache, AWS, Analytics, SQL",3+ weeks ago
Data Engineer (AWS + Python Developer),Neal Analytics,"Pune, Mumbai, Chennai, Gurugram, Bengaluru",2-7 Yrs,Neal Analytics is looking for Data Engineer (AWS + Python Developer) to join our dynami...,https://www.naukri.com/job-listings-data-engineer-aws-python-developer-neal-analytics-mumbai-pune-chennai-gurugram-bengaluru-2-to-7-years-130924500582,"Analytical skills, Focus, AWS, Python, Analytical, Data Engineering, Development, Analytical Skill",3+ weeks ago
"Data Engineer openings at US Healthcare MNC - Advantum, Hyd",Advantum Health,Hyderabad(HITEC City),3-8 Yrs,"Hands-on experience with cloud platforms (AWS, GCP, or Azure) and cloud data services (...",https://www.naukri.com/job-listings-data-engineer-openings-at-us-healthcare-mnc-advantum-hyd-advantum-health-hyderabad-3-to-8-years-040725023995,"Data Engineering, Data Engineer, Airflow, Kafka, Prefect, Ci/Cd, Devops, Docker",1 day ago
Python Developer with AWS opening | Pune location,Cynbrix Consulting,Pune,4-9 Yrs,Must have skills : Extensive exp on AWS and Python DevelopmentNP : Immediate joinerLoca...,https://www.naukri.com/job-listings-python-developer-with-aws-opening-pune-location-cynbrix-consulting-pune-4-to-9-years-040625015212,"python, aws, Python Framework, Python Development, python developer, python programmer, Development, Framework",3+ weeks ago
Data Engineer,Anchanto Services,Pune,2-7 Yrs,"The candidate must possess strong technical knowledge in data engineering, orchestratio...",https://www.naukri.com/job-listings-data-engineer-anchanto-saas-technology-pune-2-to-7-years-200625501153,"orchestration, data science, Machine learning, Cloud, Design development, Deployment, Predictive modeling, AWS",2 weeks ago
Associate-Data Engineer (DIG),Tresvista Financial Services,"Hybrid - Pune, Mumbai (All Areas)",3-8 Yrs,Overview: TresVista is looking to hire an Associate in its Data Intelligence Group team...,https://www.naukri.com/job-listings-associate-data-engineer-dig-tresvista-financial-services-pune-mumbai-all-areas-3-to-8-years-240625028610,"Data Engineer, SQL, Python, Etl Pipelines, Pyspark, Data Pipeline, Data Lake, Data Warehousing",1 week ago
Data Engineer,Coditas Technologies,Pune,2-6 Yrs,Minimum 2 years of progressive experience building solutions in Big Data environments,https://www.naukri.com/job-listings-data-engineer-coditas-technologies-pune-2-to-6-years-210525024340,"Pyspark, Azure Cloud, AWS, Python, SQL, Data Warehousing, Warehouse, Microsoft Azure",1 week ago
Data Engineer,Accenture,Indore,3-8 Yrs,. Educational Qualification : 15 years full time education . Must have skills : Databri...,https://www.naukri.com/job-listings-data-engineer-accenture-solutions-pvt-ltd-indore-3-to-8-years-270625918599,"data analytics, database design, data modeling, design principles, etl, hive, python, data warehousing",1 week ago
